{
  "acceptedCallTrackingTerms": true,
  "callTrackingCampaignID": "example_callTrackingCampaignID",
  "callTrackingEnabled": true,
  "callTrackingForwar": "example_callTrackingForwar",
  "callTrackingForwarAfterHours": "example_callTrackingForwarAfterHours",
  "callTrackingPhoneNumber": "example_callTrackingPhoneNumber",
  "callTrackingReferrer": "example_callTrackingReferrer",
  "callTrackingSearchPhrase": "example_callTrackingSearchPhrase",
  "campaignSource": "example_campaignSource",
  "code": "example_code",
  "createdBy": "example_createdBy",
  "createdDateTime": "2024-01-01T00:00:00Z",
  "customFields": [],
  "description": "example_description",
  "endDate": "2024-01-01",
  "id": 1,
  "lastModifiedBy": "example_lastModifiedBy",
  "lastModifiedDateTime": "2024-01-01T00:00:00Z",
  "name": "example_name",
  "startDate": "2024-01-01",
  "targetProspectType": "example_targetProspectType",
  "timezone": "example_timezone"
}